{
  "subject_id": "subject_6b1f45e2fa8f41198fd34c424b2e44e8",
  "role": "owner",
  "records": [
    {
      "id": "nr_3007a8a6ec384cd8acba",
      "kind": "story",
      "title": "搪瓷杯与收车后的站房",
      "text": "讲述者收拾东西时又看见一只杯沿缺了一小块的搪瓷杯。杯子是自己在小店买的，不是陈岚送的，用了多少年说不准。看到它，讲述者想起以前收车后坐在站房里喝水，车停好、人坐下才觉得一天忙完了。",
      "evidence_ids": [
        "ev_554298c7655c4701",
        "ev_76f894ab452c445e",
        "ev_524ff8493e8342c3"
      ],
      "facets": [
        "EXPERIENCE",
        "FEELINGS"
      ],
      "time_text": "",
      "place_text": "",
      "aliases": [],
      "same_event": false,
      "recipient_label": "",
      "status": "confirmed",
      "revision": 2,
      "model_version": "Deepseek-v4-flash",
      "prompt_version": "narrative-evidence-v5",
      "created_at": "2026-10-11T02:47:15.701930+00:00",
      "updated_at": "2026-10-11T02:49:38.196515+00:00",
      "evidence": [
        {
          "evidence_id": "ev_554298c7655c4701",
          "excerpt": "今天收拾东西，又看见那只搪瓷杯了，杯沿缺的一小块还在呢。",
          "source_type": "SUBJECT",
          "episode_id": "ep_03ab92c8acdb4e9e",
          "temporal_context": ""
        },
        {
          "evidence_id": "ev_76f894ab452c445e",
          "excerpt": "这杯子是我自己在小店买的，不是她送的，用了多少年，我真说不准。",
          "source_type": "SUBJECT",
          "episode_id": "ep_03ab92c8acdb4e9e",
          "temporal_context": ""
        },
        {
          "evidence_id": "ev_524ff8493e8342c3",
          "excerpt": "我一看见她，就想起以前收车以后坐在站房里喝水，车停好了，人坐下来才觉得这一天忙完了。\n\n",
          "source_type": "SUBJECT",
          "episode_id": "ep_03ab92c8acdb4e9e",
          "temporal_context": ""
        }
      ],
      "label": "本人审核的系统整理",
      "historical": false,
      "source_valid": true
    },
    {
      "id": "nr_51549e0a14e94551b913",
      "kind": "story",
      "title": "第一次独立跑十二路",
      "text": "讲述者年轻时在南京开公交，第一条自己独立跑的线路是12路，印象里是1986年上岗，但表示要再看看工作证，怕记差一年。那时工作证放胸前口袋，出门就摸一下，怕忘带。",
      "evidence_ids": [
        "ev_b1b626d8212744fe",
        "ev_967572b3cb514c06"
      ],
      "facets": [
        "EXPERIENCE",
        "IDENTITY",
        "PRACTICES"
      ],
      "time_text": "1986年，不过这个要再看看工作证，我怕记差一年",
      "place_text": "南京",
      "aliases": [],
      "same_event": false,
      "recipient_label": "",
      "status": "stale",
      "revision": 3,
      "model_version": "Deepseek-v4-flash",
      "prompt_version": "narrative-evidence-v5",
      "created_at": "2026-10-11T02:47:15.712965+00:00",
      "updated_at": "2026-10-11T02:49:51.794740+00:00",
      "evidence": [],
      "label": "本人审核的系统整理",
      "historical": true,
      "source_valid": false
    },
    {
      "id": "nr_97cd5afefcfb4cb3bdd7",
      "kind": "story",
      "title": "第一次收车后在站房坐着",
      "text": "讲述者记得第一次收车没立刻回家，在站房坐了一会儿，同事在旁边聊白天的事，自己就听着，具体聊什么已记不住，但记得那一下松口气的感觉。",
      "evidence_ids": [
        "ev_6f6d6061d2d348d5"
      ],
      "facets": [
        "EXPERIENCE",
        "FEELINGS"
      ],
      "time_text": "第一次收车",
      "place_text": "站房",
      "aliases": [],
      "same_event": false,
      "recipient_label": "",
      "status": "rejected",
      "revision": 3,
      "model_version": "Deepseek-v4-flash",
      "prompt_version": "narrative-evidence-v5",
      "created_at": "2026-10-11T02:47:15.714569+00:00",
      "updated_at": "2026-10-11T03:09:28.782947+00:00",
      "evidence": [
        {
          "evidence_id": "ev_6f6d6061d2d348d5",
          "excerpt": "第一次收车，我没立刻回家，在站房坐了一会儿，同事们在旁边聊白天的事，我就听着，具体聊什么已经记不住了，倒是那一下松口气的感觉。",
          "source_type": "SUBJECT",
          "episode_id": "ep_03ab92c8acdb4e9e",
          "temporal_context": ""
        }
      ],
      "label": "待核对的整理建议",
      "historical": false,
      "source_valid": true
    },
    {
      "id": "nr_3d0cabff453f4f118d1b",
      "kind": "person",
      "title": "陈岚",
      "text": "陈岚是陈守义的女儿。小时候放学回家，她把书包放在门边，去厨房找妈妈孙玉琴；吃饭时愿意讲学校的事。后来她问父亲为什么总说“平安回家比多跑一趟重要”，父亲先想了想，再用厨房留灯的日常回应。她提议陪父亲去老车队，但时间和父亲当天是否愿意出门都还没定。",
      "evidence_ids": [
        "ev_da25f6dedecf40fe",
        "ev_afc9280f22d247af",
        "ev_b0b9ccb798ea44a0",
        "ev_735212b22d994af5",
        "ev_140acf3cef8e4fff",
        "ev_47d01b9d66e74bad"
      ],
      "facets": [
        "RELATIONSHIPS"
      ],
      "time_text": "",
      "place_text": "南京",
      "aliases": [
        "陈岚"
      ],
      "same_event": false,
      "recipient_label": "",
      "status": "confirmed",
      "revision": 5,
      "model_version": "Deepseek-v4-flash",
      "prompt_version": "narrative-evidence-v5",
      "created_at": "2026-10-11T02:47:15.716791+00:00",
      "updated_at": "2026-10-11T03:09:30.385930+00:00",
      "evidence": [
        {
          "evidence_id": "ev_da25f6dedecf40fe",
          "excerpt": "陈岚，小时候放学一回来就把书包放在门边，到厨房找她妈妈，她妈妈叫孙玉琴，我平时就喊玉琴。\n\n",
          "source_type": "SUBJECT",
          "episode_id": "ep_a331afcab3ad4dc8",
          "temporal_context": ""
        },
        {
          "evidence_id": "ev_afc9280f22d247af",
          "excerpt": "那时候我们住在南京鼓楼的老小区，吃饭时女儿总有话讲，学校里谁又做了什么？",
          "source_type": "SUBJECT",
          "episode_id": "ep_a331afcab3ad4dc8",
          "temporal_context": "历史记载，后来已有变化，不代表当前状态。变化时间：2024年以后，具体月份不确定"
        },
        {
          "evidence_id": "ev_b0b9ccb798ea44a0",
          "excerpt": "陈岚问我，怎么总把平安回家比多跑一趟重要挂在嘴边，这句话我说惯了，她认真一问，我倒停住了，不是不愿意告诉他，就是一时不知道从哪儿讲起。\n\n",
          "source_type": "SUBJECT",
          "episode_id": "ep_82de72274ae44a0b",
          "temporal_context": ""
        },
        {
          "evidence_id": "ev_735212b22d994af5",
          "excerpt": "陈岚，前几天你问我那句话，我想好了，从你妈妈那盏灯讲起吧。\n\n",
          "source_type": "SUBJECT",
          "episode_id": "ep_55d7960102d74610",
          "temporal_context": ""
        },
        {
          "evidence_id": "ev_140acf3cef8e4fff",
          "excerpt": "陈岚前两天说有空陪我去老车队看看，我听着挺高兴，不过还没说定他什么时候有空。\n\n",
          "source_type": "SUBJECT",
          "episode_id": "ep_ed240efd5e804a3f",
          "temporal_context": ""
        },
        {
          "evidence_id": "ev_47d01b9d66e74bad",
          "excerpt": "我那天想不想出门都得再商量，别现在就忙着安排在家听玉琴，慢慢讲以前的事也挺好。\n\n",
          "source_type": "SUBJECT",
          "episode_id": "ep_ed240efd5e804a3f",
          "temporal_context": ""
        }
      ],
      "label": "本人审核的系统整理",
      "historical": false,
      "source_valid": true
    },
    {
      "id": "nr_515ff5e8f1704ae89afd",
      "kind": "style",
      "title": "平安回家",
      "text": "平安回家比多跑一趟重要。",
      "evidence_ids": [
        "ev_9d540971a2cb4c0d"
      ],
      "facets": [
        "EXPRESSION",
        "VALUES"
      ],
      "time_text": "",
      "place_text": "",
      "aliases": [],
      "same_event": false,
      "recipient_label": "",
      "status": "confirmed",
      "revision": 2,
      "model_version": "owner",
      "prompt_version": "owner",
      "created_at": "2026-10-11T02:49:52.073813+00:00",
      "updated_at": "2026-10-11T02:49:52.123483+00:00",
      "evidence": [
        {
          "evidence_id": "ev_9d540971a2cb4c0d",
          "excerpt": "后来我常跟陈岚说，平安回家比多跑一趟重要。",
          "source_type": "SUBJECT",
          "episode_id": "ep_03ab92c8acdb4e9e",
          "temporal_context": ""
        }
      ],
      "label": "本人审核的系统整理",
      "historical": false,
      "source_valid": true
    },
    {
      "id": "nr_c3b871d49f494f57a59a",
      "kind": "story",
      "title": "女儿放学后到厨房找妈妈",
      "text": "讲述者回忆陈岚小时候放学一回来就把书包放在门边，到厨房找她妈妈孙玉琴，讲述者平时喊玉琴。",
      "evidence_ids": [
        "ev_da25f6dedecf40fe"
      ],
      "facets": [
        "EXPERIENCE",
        "RELATIONSHIPS"
      ],
      "time_text": "",
      "place_text": "",
      "aliases": [],
      "same_event": false,
      "recipient_label": "",
      "status": "confirmed",
      "revision": 2,
      "model_version": "Deepseek-v4-flash",
      "prompt_version": "narrative-evidence-v5",
      "created_at": "2026-10-11T03:03:37.640615+00:00",
      "updated_at": "2026-10-11T03:09:30.474407+00:00",
      "evidence": [
        {
          "evidence_id": "ev_da25f6dedecf40fe",
          "excerpt": "陈岚，小时候放学一回来就把书包放在门边，到厨房找她妈妈，她妈妈叫孙玉琴，我平时就喊玉琴。\n\n",
          "source_type": "SUBJECT",
          "episode_id": "ep_a331afcab3ad4dc8",
          "temporal_context": ""
        }
      ],
      "label": "本人审核的系统整理",
      "historical": false,
      "source_valid": true
    },
    {
      "id": "nr_2871aa6a6603420b9de6",
      "kind": "story",
      "title": "南京鼓楼老小区的饭桌闲话",
      "text": "住在南京鼓楼时，女儿在饭桌上很愿意讲学校的事。陈守义有时想着车队排班，嘴上答应却没仔细听。如今他觉得可惜：不是怪女儿不肯讲，而是自己听得不够仔细；那些闲话不像成绩单一样能留下来。",
      "evidence_ids": [
        "ev_afc9280f22d247af",
        "ev_d1e3ebf36ad14c70",
        "ev_8e91cacda3534bd4",
        "ev_6c1d2f7dbb3f48d7"
      ],
      "facets": [
        "EXPERIENCE",
        "RELATIONSHIPS",
        "FEELINGS"
      ],
      "time_text": "",
      "place_text": "南京鼓楼的老小区",
      "aliases": [],
      "same_event": false,
      "recipient_label": "",
      "status": "confirmed",
      "revision": 3,
      "model_version": "Deepseek-v4-flash",
      "prompt_version": "narrative-evidence-v5",
      "created_at": "2026-10-11T03:03:37.644430+00:00",
      "updated_at": "2026-10-11T03:09:30.562105+00:00",
      "evidence": [
        {
          "evidence_id": "ev_afc9280f22d247af",
          "excerpt": "那时候我们住在南京鼓楼的老小区，吃饭时女儿总有话讲，学校里谁又做了什么？",
          "source_type": "SUBJECT",
          "episode_id": "ep_a331afcab3ad4dc8",
          "temporal_context": "历史记载，后来已有变化，不代表当前状态。变化时间：2024年以后，具体月份不确定"
        },
        {
          "evidence_id": "ev_d1e3ebf36ad14c70",
          "excerpt": "今天碰到什么事，我有时还想着车队第二天怎么排班，嘴上答应着，其实没听进去。\n\n",
          "source_type": "SUBJECT",
          "episode_id": "ep_a331afcab3ad4dc8",
          "temporal_context": ""
        },
        {
          "evidence_id": "ev_8e91cacda3534bd4",
          "excerpt": "现在想起来挺可惜的，不是怪她不肯讲，她那时候很愿意讲，是我听得不够仔细。\n\n",
          "source_type": "SUBJECT",
          "episode_id": "ep_a331afcab3ad4dc8",
          "temporal_context": ""
        },
        {
          "evidence_id": "ev_6c1d2f7dbb3f48d7",